{
  "schema": "cdeadmin.ui-form.v1",
  "engine": "mysql",
  "family": "routine",
  "variant": "function",
  "resource_kinds": [
    "function"
  ],
  "status": "draft",
  "engine_tab_title": "MySQL",
  "omitted_tabs": [],
  "gaps": [
    {
      "concept": "Body and signature edits",
      "reason": "Native ALTER PROCEDURE/FUNCTION changes characteristics, not the signature, body, definer or determinism. Existing explicit DROP/CREATE and DDN workflows remain separate; the family never silently replaces a routine."
    },
    {
      "concept": "Privilege changes",
      "reason": "Privileges use separate native grant/revoke operations. Family grid diff dispatch remains Decision9."
    },
    {
      "concept": "Imported libraries and non-SQL runtimes",
      "reason": "Community can retain native library definitions; non-SQL execution depends on a separately implemented runtime. Closed Enterprise MLE execution remains post beta, not an emulated SQL routine."
    }
  ],
  "fields": [
    {
      "field_id": "name",
      "label": "Name",
      "control": "text",
      "tab": "General",
      "modes": [
        "create"
      ],
      "required": true
    },
    {
      "field_id": "parent",
      "label": "Database",
      "control": "reference",
      "tab": "General",
      "modes": [
        "create"
      ],
      "reference_kind": "database",
      "required": true
    },
    {
      "field_id": "comment",
      "label": "Comment",
      "control": "text",
      "tab": "General",
      "default_path": [
        "routine_comment"
      ],
      "help": "An empty ALTER comment is ignored by native MySQL9.7; leave this field absent to preserve it."
    },
    {
      "field_id": "returns",
      "label": "Returns",
      "control": "text",
      "tab": "General",
      "modes": [
        "create"
      ],
      "required": true,
      "default_path": [
        "returns"
      ],
      "help": "Native return type including its length, precision and optional character-set/collation modifiers."
    },
    {
      "field_id": "if_not_exists",
      "label": "If not exists",
      "control": "boolean",
      "tab": "General",
      "modes": [
        "create"
      ],
      "default": false
    },
    {
      "field_id": "parameters",
      "label": "Parameters",
      "control": "grid",
      "tab": "Parameters",
      "modes": [
        "create"
      ],
      "columns": [
        {
          "field_id": "name",
          "label": "Name",
          "control": "text",
          "required": true
        },
        {
          "field_id": "mode",
          "label": "Mode",
          "control": "select",
          "options": [
            {
              "value": "IN",
              "label": "IN"
            }
          ],
          "default": "IN"
        },
        {
          "field_id": "type",
          "label": "Type",
          "control": "text",
          "required": true
        },
        {
          "field_id": "character_set",
          "label": "Character set",
          "control": "text"
        },
        {
          "field_id": "collation",
          "label": "Collation",
          "control": "text"
        }
      ],
      "reorderable": true,
      "default": [],
      "default_path": [
        "parameter_records"
      ],
      "help": "Parameter defaults are not part of the native MySQL9.7 routine grammar. Procedure output parameters use OUT or INOUT; functions accept input parameters."
    },
    {
      "field_id": "body",
      "label": "Body",
      "control": "code",
      "tab": "Definition",
      "modes": [
        "create"
      ],
      "language": "sql",
      "required": true,
      "default_path": [
        "routine_definition"
      ]
    },
    {
      "field_id": "security_create",
      "label": "Security",
      "control": "select",
      "tab": "Options",
      "modes": [
        "create"
      ],
      "options": [
        {
          "value": "DEFINER",
          "label": "DEFINER"
        },
        {
          "value": "INVOKER",
          "label": "INVOKER"
        }
      ],
      "backend_field_id": "sql_security",
      "default": "DEFINER"
    },
    {
      "field_id": "data_access_create",
      "label": "Data access",
      "control": "select",
      "tab": "Options",
      "modes": [
        "create"
      ],
      "options": [
        {
          "value": "CONTAINS SQL",
          "label": "CONTAINS SQL"
        },
        {
          "value": "NO SQL",
          "label": "NO SQL"
        },
        {
          "value": "READS SQL DATA",
          "label": "READS SQL DATA"
        },
        {
          "value": "MODIFIES SQL DATA",
          "label": "MODIFIES SQL DATA"
        }
      ],
      "backend_field_id": "data_access",
      "default": "CONTAINS SQL"
    },
    {
      "field_id": "security_alter",
      "label": "Security",
      "control": "select",
      "tab": "Options",
      "modes": [
        "alter"
      ],
      "options": [
        {
          "value": "UNCHANGED",
          "label": "Unchanged"
        },
        {
          "value": "DEFINER",
          "label": "DEFINER"
        },
        {
          "value": "INVOKER",
          "label": "INVOKER"
        }
      ],
      "backend_field_id": "sql_security",
      "default": "UNCHANGED"
    },
    {
      "field_id": "data_access_alter",
      "label": "Data access",
      "control": "select",
      "tab": "Options",
      "modes": [
        "alter"
      ],
      "options": [
        {
          "value": "UNCHANGED",
          "label": "Unchanged"
        },
        {
          "value": "CONTAINS SQL",
          "label": "CONTAINS SQL"
        },
        {
          "value": "NO SQL",
          "label": "NO SQL"
        },
        {
          "value": "READS SQL DATA",
          "label": "READS SQL DATA"
        },
        {
          "value": "MODIFIES SQL DATA",
          "label": "MODIFIES SQL DATA"
        }
      ],
      "backend_field_id": "data_access",
      "default": "UNCHANGED"
    },
    {
      "field_id": "deterministic",
      "label": "Deterministic",
      "control": "boolean",
      "tab": "Options",
      "modes": [
        "create"
      ],
      "default": false
    },
    {
      "field_id": "language",
      "label": "Language",
      "control": "select",
      "tab": "Options",
      "modes": [
        "create"
      ],
      "options": [
        {
          "value": "SQL",
          "label": "SQL"
        }
      ],
      "default": "SQL"
    },
    {
      "field_id": "definer_user",
      "label": "Definer user",
      "control": "text",
      "tab": "Engine",
      "modes": [
        "create"
      ]
    },
    {
      "field_id": "definer_host",
      "label": "Definer host",
      "control": "text",
      "tab": "Engine",
      "modes": [
        "create"
      ]
    },
    {
      "field_id": "confirmation",
      "label": "Confirmation",
      "control": "text",
      "tab": "Engine",
      "modes": [
        "alter"
      ],
      "required": true,
      "help": "Enter the selected routine name."
    }
  ],
  "notes": "Audited native bindings. The capability form reference selects the native variant without an operation/kind picker. Create and alter have separate characteristic defaults, so editing a comment does not reset security or data access. Shared render/round-trip acceptance remains with the front-end stream."
}
