{
  "schema": "cdeadmin.ui-form.v1",
  "engine": "yugabytedb",
  "family": "type",
  "resource_kinds": [
    "type",
    "domain"
  ],
  "status": "complete",
  "engine_tab_title": "YugabyteDB",
  "omitted_tabs": [],
  "gaps": [
    {
      "concept": "Composite attribute changes",
      "reason": "ADD / DROP / ALTER / RENAME ATTRIBUTE are not supported in YugabyteDB 2025.2.2.2 (live)",
      "tracking": "postgresql-wire-parity"
    },
    {
      "concept": "Domain NOT NULL and constraint changes",
      "reason": "ALTER DOMAIN SET / DROP NOT NULL and ADD / DROP / VALIDATE / RENAME CONSTRAINT are not supported yet (live)",
      "tracking": "postgresql-wire-parity"
    },
    {
      "concept": "Dropping enum values",
      "reason": "No DROP VALUE in PostgreSQL or YugabyteDB",
      "tracking": "postgresql-wire-parity"
    },
    {
      "concept": "Range type options beyond subtype_diff (collation, canonical, multirange name), base types",
      "reason": "No editor yet",
      "tracking": "postgresql-wire-parity"
    }
  ],
  "fields": [
    {
      "field_id": "variant",
      "label": "Kind",
      "tab": "General",
      "control": "select",
      "ui_only": true,
      "editable_after_create": false,
      "options": [
        {
          "value": "domain",
          "label": "Domain"
        }
      ],
      "help": "Set for a domain; a type leaves it empty."
    },
    {
      "field_id": "name",
      "label": "Name",
      "tab": "General",
      "control": "text",
      "required": true,
      "help": "Renaming runs ALTER TYPE ... RENAME TO."
    },
    {
      "field_id": "parent",
      "label": "Schema",
      "tab": "General",
      "control": "reference",
      "reference_kind": "schema",
      "reference_value": "display_name",
      "editable_after_create": false
    },
    {
      "field_id": "type_kind",
      "label": "Kind",
      "tab": "General",
      "control": "select",
      "required": true,
      "default": "ENUM",
      "editable_after_create": false,
      "options": [
        {
          "value": "ENUM",
          "label": "Enum"
        },
        {
          "value": "COMPOSITE",
          "label": "Composite"
        },
        {
          "value": "RANGE",
          "label": "Range"
        }
      ],
      "visible_when": {
        "field": "variant",
        "truthy": false
      }
    },
    {
      "field_id": "enum_values",
      "label": "Enum values",
      "tab": "General",
      "control": "grid",
      "item_kind": "string",
      "reorderable": true,
      "visible_when": {
        "field": "type_kind",
        "equals": "ENUM"
      },
      "help": "In order. New values can be added anywhere; an existing value can be renamed but not dropped or moved.",
      "columns": [
        {
          "field_id": "value",
          "label": "Value",
          "control": "text",
          "required": true,
          "editable_after_create": false
        }
      ]
    },
    {
      "field_id": "rename_values",
      "label": "Rename values",
      "tab": "General",
      "control": "grid",
      "modes": [
        "alter"
      ],
      "visible_when": {
        "field": "type_kind",
        "equals": "ENUM"
      },
      "help": "ALTER TYPE ... RENAME VALUE; applied before additions.",
      "columns": [
        {
          "field_id": "from",
          "label": "Current value",
          "control": "text",
          "required": true
        },
        {
          "field_id": "to",
          "label": "New value",
          "control": "text",
          "required": true
        }
      ]
    },
    {
      "field_id": "fields",
      "label": "Fields",
      "tab": "General",
      "control": "grid",
      "required": true,
      "visible_when": {
        "field": "type_kind",
        "equals": "COMPOSITE"
      },
      "editable_after_create": false,
      "help": "A composite type's fields are fixed once created (YugabyteDB does not alter attributes).",
      "columns": [
        {
          "field_id": "name",
          "label": "Field",
          "control": "text",
          "required": true
        },
        {
          "field_id": "type",
          "label": "Type",
          "control": "text",
          "required": true
        }
      ]
    },
    {
      "field_id": "subtype",
      "label": "Subtype",
      "tab": "General",
      "control": "text",
      "required": true,
      "visible_when": {
        "field": "type_kind",
        "equals": "RANGE"
      },
      "editable_after_create": false,
      "help": "e.g. timestamptz"
    },
    {
      "field_id": "subtype_diff",
      "label": "Subtype difference function",
      "tab": "General",
      "control": "text",
      "visible_when": {
        "field": "type_kind",
        "equals": "RANGE"
      },
      "editable_after_create": false
    },
    {
      "field_id": "base_type",
      "label": "Base type",
      "tab": "General",
      "control": "text",
      "required": true,
      "visible_when": {
        "field": "variant",
        "equals": "domain"
      },
      "editable_after_create": false,
      "help": "e.g. varchar(20)"
    },
    {
      "field_id": "collation",
      "label": "Collation",
      "tab": "General",
      "control": "text",
      "visible_when": {
        "field": "variant",
        "equals": "domain"
      },
      "editable_after_create": false
    },
    {
      "field_id": "default",
      "label": "Default",
      "tab": "General",
      "control": "text",
      "visible_when": {
        "field": "variant",
        "equals": "domain"
      },
      "help": "ALTER DOMAIN SET / DROP DEFAULT"
    },
    {
      "field_id": "not_null",
      "label": "Not null",
      "tab": "General",
      "control": "boolean",
      "default": false,
      "visible_when": {
        "field": "variant",
        "equals": "domain"
      },
      "editable_after_create": false,
      "help": "Fixed once created: YugabyteDB does not support ALTER DOMAIN SET / DROP NOT NULL."
    },
    {
      "field_id": "comment",
      "label": "Comment",
      "tab": "General",
      "control": "text",
      "help": "COMMENT ON TYPE / DOMAIN"
    },
    {
      "field_id": "checks",
      "label": "Checks",
      "tab": "Constraints",
      "control": "grid",
      "visible_when": {
        "field": "variant",
        "equals": "domain"
      },
      "editable_after_create": false,
      "help": "CHECK constraints on VALUE; fixed once created (no ALTER DOMAIN constraint changes in YugabyteDB).",
      "columns": [
        {
          "field_id": "name",
          "label": "Name",
          "control": "text"
        },
        {
          "field_id": "expression",
          "label": "Expression",
          "control": "code",
          "language": "sql",
          "required": true
        }
      ]
    }
  ],
  "notes": "Started from the CockroachDB type form; enum_values and fields as YugabyteDB's and DuckDB's type forms name them (the CockroachDB form said values; aligned and checked live 2026-10-31). providers/yugabytedb/types.py; records from pg_enum, pg_attribute, pg_range, pg_type and pg_constraint. Round trip verified live on YugabyteDB 2025.2.2.2 by tools/tests/test_ui_descriptor_roundtrip_yugabytedb.py (2026-10-30)."
}
