{
  "schema": "cdeadmin.ui-form.v1",
  "engine": "mariadb",
  "family": "database",
  "resource_kinds": [
    "database"
  ],
  "status": "draft",
  "engine_tab_title": "MariaDB",
  "omitted_tabs": [],
  "gaps": [],
  "fields": [
    {
      "field_id": "name",
      "label": "MariaDB database name",
      "tab": "General",
      "control": "text",
      "required": true
    },
    {
      "field_id": "or_replace",
      "label": "Replace an existing database",
      "tab": "General",
      "control": "boolean",
      "required": false,
      "default": false
    },
    {
      "field_id": "if_not_exists",
      "label": "Do not fail if it already exists",
      "tab": "General",
      "control": "boolean",
      "required": false,
      "default": false
    },
    {
      "field_id": "comment",
      "label": "Database comment",
      "tab": "General",
      "control": "text",
      "required": false
    },
    {
      "field_id": "character_set",
      "label": "Default character set",
      "tab": "Options",
      "control": "text",
      "required": false
    },
    {
      "field_id": "collation",
      "label": "Default collation",
      "tab": "Options",
      "control": "text",
      "required": false
    }
  ],
  "notes": "Drafted by tools/draft_ui_descriptors.py from the provider's effective create/alter forms; field ids, options and visibility are the provider's own. Review tab placement, finish typing any keyvalue field listed under gaps, split combined constraint grids, then set status complete after a verified round trip."
}
