{
  "schema": "cdeadmin.ui-form.v1",
  "engine": "duckdb",
  "family": "routine",
  "resource_kinds": [
    "macro"
  ],
  "status": "complete",
  "engine_tab_title": "DuckDB",
  "omitted_tabs": [],
  "gaps": [],
  "fields": [
    {
      "field_id": "name",
      "label": "Name",
      "tab": "General",
      "control": "text",
      "required": true
    },
    {
      "field_id": "parameters",
      "label": "Parameters",
      "tab": "Parameters",
      "control": "grid",
      "required": false,
      "columns": [
        {
          "field_id": "name",
          "label": "Name",
          "control": "text",
          "required": true
        },
        {
          "field_id": "default",
          "label": "Default (optional)",
          "control": "text",
          "help": "Omit for a required parameter."
        }
      ],
      "help": "Macro parameters in order."
    },
    {
      "field_id": "expression",
      "label": "Expression/query",
      "tab": "Definition",
      "control": "code",
      "language": "sql",
      "required": true,
      "help": "Enter the expression or SELECT, not CREATE."
    },
    {
      "field_id": "source",
      "label": "Complete qualified CREATE OR REPLACE MACRO statement",
      "tab": "Definition",
      "control": "code",
      "language": "sql",
      "required": true,
      "help": "DuckDB replaces the entire definition and all macro overloads.",
      "modes": [
        "alter"
      ]
    },
    {
      "field_id": "table_macro",
      "label": "Table-returning",
      "tab": "Options",
      "control": "boolean",
      "required": false,
      "default": false
    },
    {
      "field_id": "complete_definition_confirmed",
      "label": "I reviewed the complete replacement definition",
      "tab": "Options",
      "control": "boolean",
      "required": true,
      "modes": [
        "alter"
      ],
      "group": "Replace confirmation",
      "help": " Required by the provider before it replaces the definition."
    },
    {
      "field_id": "metadata_reset_acknowledged",
      "label": "I accept that native replacement clears comments and tags",
      "tab": "Options",
      "control": "boolean",
      "required": true,
      "modes": [
        "alter"
      ],
      "group": "Replace confirmation",
      "help": " Required by the provider before it replaces the definition."
    }
  ],
  "notes": "Drafted by tools/draft_ui_descriptors.py from the provider's effective create/alter forms; field ids, options and visibility are the provider's own. Review tab placement, finish typing any keyvalue field listed under gaps, split combined constraint grids, then set status complete after a verified round trip. Reviewed by tools/review_ui_descriptors.py: DuckDB replace acknowledgements grouped under Options. parameters typed as a grid of name/default records (the provider accepts names or {name, default}). Round trip verified in-process (create, re-inspect) on DuckDB 2.0.0 (profile pins 1.5.2) by tools/tests/test_ui_descriptor_roundtrip_duckdb.py. Native qualification on the pinned version remains with the platform teams."
}
